{
  "capability_observation_id": "SYNTH-CAPABILITY-OBS-0001",
  "stable_capability_id": "SYNTH.PRODUCT.ALPHA.CAPABILITY",
  "product_observation_id": "SYNTH-PRODUCT-OBS-0001",
  "capability": "Alpha capability",
  "availability_status": "ga",
  "confidence": "high",
  "evidence": [
    {
      "source_id": "synth-source-0002",
      "passage_id": "synth-passage-0003",
      "quote": "alpha ships"
    }
  ]
}
